<?xml version="1.0" encoding="UTF-8"?>
<list xmlns:xsi="http://www.w3.org/2001/XMLSchema-instance" xsi:noNamespaceSchemaLocation="../xsd/multisell.xsd">
	<npcs>
		<npc>33587</npc> <!-- Mentor Guide -->
	</npcs>
	<!-- TODO: Part 3
	<item>
		<ingredient id="33804" count="100000" /> --> <!-- Mentee's Mark --> 
	<!-- <production id="48937" count="1" /> --> <!-- Atlas' Earring --> 
	<!-- </item> -->
	<!-- TODO: Part 3
	<item>
		<ingredient id="33804" count="10000" /> --> <!-- Mentee's Mark --> 
	<!-- <production id="48937" count="1" /> --> <!-- Mask Expert's --> 
	<!-- </item> -->
	<!-- TODO: Part 3
	<item>
		<ingredient id="33804" count="10000" /> --> <!-- Mentee's Mark --> 
	<!-- <production id="48937" count="1" /> --> <!-- Scroll: Enchant Expert's Mask --> 
	<!-- </item> -->
	<item>
		<ingredient id="33804" count="5000" /> <!-- Mentee's Mark --> 
		<production id="48848" count="1" /> <!-- Freya's Ice Rose - Event --> 
	</item>
	<item>
		<ingredient id="33804" count="8000" /> <!-- Mentee's Mark --> 
		<production id="80832" count="1" /> <!-- Emperor's Special Cocktail Event --> 
	</item>
	<item>
		<ingredient id="33804" count="5000" /> <!-- Mentee's Mark --> 
		<!-- TODO: Swap on Event item -->
		<production id="80842" count="1" /> <!-- Honey Dark Beer Event --> 
	</item>
	<item>
		<ingredient id="33804" count="5000" /> <!-- Mentee's Mark --> 
		<production id="48755" count="1" /> <!-- Glowing Dragon's Attribute Potion (XP) Event --> 
	</item>
	<item>
		<ingredient id="33804" count="20000" /> <!-- Mentee's Mark --> 
		<production id="80797" count="1" /> <!-- Shining Nevit's Gold Hourglass Event --> 
	</item>
	<!-- TODO: Part 3
	<item>
		<ingredient id="33804" count="5000" /> --> <!-- Mentee's Mark --> 
		<!-- <production id="33870" count="1" /> --> <!-- Blessed Scroll: Enchant Bracelet --> 
	<!-- </item> -->
	<item>
		<ingredient id="33804" count="20000" /> <!-- Mentee's Mark --> 
		<production id="48498" count="1" /> <!-- Blessed Scroll: Enchant Dragon Shirt --> 
	</item>
	<!-- TODO: Part 3
	<item>
		<ingredient id="33804" count="45000" /> --> <!-- Mentee's Mark --> 
		<!-- <production id="33872" count="1" /> --> <!-- Blessed Scroll: Enchant Circlet --> 
	<!-- </item> -->
	<!-- TODO: Part 3
	<item>
		<ingredient id="33804" count="100000" /> --> <!-- Mentee's Mark --> 
		<!-- <production id="33873" count="1" /> --> <!-- Shining Platinum Jewelry --> 
	<!-- </item> -->
	<item>
		<ingredient id="33804" count="50000" /> <!-- Mentee's Mark --> 
		<production id="48124" count="1" /> <!-- Fairy Agathion Charm --> 
	</item>
</list>