<?xml version="1.0" encoding="UTF-8"?>
<list maintainEnchantment="true" xmlns:xsi="http://www.w3.org/2001/XMLSchema-instance" xsi:noNamespaceSchemaLocation="../xsd/multisell.xsd">
	<npcs>
		<npc>30298</npc> <!-- Pinter -->
		<npc>30300</npc> <!-- Pushkin -->
		<npc>30317</npc> <!-- Kluto -->
		<npc>30458</npc> <!-- Poitan -->
		<npc>30471</npc> <!-- Rupio -->
		<npc>30678</npc> <!-- Helton -->
		<npc>30688</npc> <!-- Duning -->
		<npc>30846</npc> <!-- Wilbert -->
		<npc>30898</npc> <!-- Morning -->
		<npc>31271</npc> <!-- Hilda -->
		<npc>31316</npc> <!-- Vincenz -->
		<npc>31583</npc> <!-- Feynn -->
		<npc>31960</npc> <!-- Buryun -->
		<npc>31990</npc> <!-- Siger -->
		<npc>33998</npc> <!-- Momet -->
		<npc>34208</npc> <!-- Bartman -->
	</npcs>
	<item>
		<ingredient id="80090" count="1" /> <!-- Krishna Shaper -->
		<ingredient id="19440" count="1406" /> <!-- R-grade Gemstone -->
		<ingredient id="36515" count="7700" /> <!-- Elcyum -->
		<ingredient id="57" count="5058112338" /> <!-- Adena -->
		<production id="80133" count="1" /> <!-- Enhanced Krishna Shaper -->
	</item>
	<item>
		<ingredient id="80091" count="1" /> <!-- Krishna Cutter -->
		<ingredient id="19440" count="1406" /> <!-- R-grade Gemstone -->
		<ingredient id="36515" count="7700" /> <!-- Elcyum -->
		<ingredient id="57" count="5058112338" /> <!-- Adena -->
		<production id="80134" count="1" /> <!-- Enhanced Krishna Shaper -->
	</item>
	<item>
		<ingredient id="80092" count="1" /> <!-- Krishna Slashe -->
		<ingredient id="19440" count="1406" /> <!-- R-grade Gemstone -->
		<ingredient id="36515" count="7700" /> <!-- Elcyum -->
		<ingredient id="57" count="5058112338" /> <!-- Adena -->
		<production id="80135" count="1" /> <!-- Enhanced Krishna Slashe -->
	</item>
	<item>
		<ingredient id="80093" count="1" /> <!-- Krishna Avenger -->
		<ingredient id="19440" count="1406" /> <!-- R-grade Gemstone -->
		<ingredient id="36515" count="7700" /> <!-- Elcyum -->
		<ingredient id="57" count="5058112338" /> <!-- Adena -->
		<production id="80136" count="1" /> <!-- Enhanced Krishna Avenger -->
	</item>
	<item>
		<ingredient id="80094" count="1" /> <!-- Krishna Fighter -->
		<ingredient id="19440" count="1406" /> <!-- R-grade Gemstone -->
		<ingredient id="36515" count="7700" /> <!-- Elcyum -->
		<ingredient id="57" count="5058112338" /> <!-- Adena -->
		<production id="80137" count="1" /> <!-- Enhanced Krishna Fighter -->
	</item>
	<item>
		<ingredient id="80095" count="1" /> <!-- Krishna Stormer -->
		<ingredient id="19440" count="1406" /> <!-- R-grade Gemstone -->
		<ingredient id="36515" count="7700" /> <!-- Elcyum -->
		<ingredient id="57" count="5058112338" /> <!-- Adena -->
		<production id="80138" count="1" /> <!-- Enhanced Krishna Stormer -->
	</item>
	<item>
		<ingredient id="80096" count="1" /> <!-- Krishna Krishna Thrower -->
		<ingredient id="19440" count="1406" /> <!-- R-grade Gemstone -->
		<ingredient id="36515" count="7700" /> <!-- Elcyum -->
		<ingredient id="57" count="5058112338" /> <!-- Adena -->
		<production id="80139" count="1" /> <!-- Enhanced Krishna Thrower -->
	</item>
	<item>
		<ingredient id="80097" count="1" /> <!-- Krishna Shooter -->
		<ingredient id="19440" count="1406" /> <!-- R-grade Gemstone -->
		<ingredient id="36515" count="7700" /> <!-- Elcyum -->
		<ingredient id="57" count="5058112338" /> <!-- Adena -->
		<production id="80140" count="1" /> <!-- Enhanced Krishna Shooter -->
	</item>
	<item>
		<ingredient id="80098" count="1" /> <!-- Krishna Buster -->
		<ingredient id="19440" count="1406" /> <!-- R-grade Gemstone -->
		<ingredient id="36515" count="7700" /> <!-- Elcyum -->
		<ingredient id="57" count="5058112338" /> <!-- Adena -->
		<production id="80141" count="1" /> <!-- Enhanced Krishna Buster -->
	</item>
	<item>
		<ingredient id="80099" count="1" /> <!-- Krishna Caster -->
		<ingredient id="19440" count="1406" /> <!-- R-grade Gemstone -->
		<ingredient id="36515" count="7700" /> <!-- Elcyum -->
		<ingredient id="57" count="5058112338" /> <!-- Adena -->
		<production id="80142" count="1" /> <!-- Enhanced Krishna Caster -->
	</item>
	<item>
		<ingredient id="80100" count="1" /> <!-- Krishna Retributer -->
		<ingredient id="19440" count="1406" /> <!-- R-grade Gemstone -->
		<ingredient id="36515" count="7700" /> <!-- Elcyum -->
		<ingredient id="57" count="5058112338" /> <!-- Adena -->
		<production id="80143" count="1" /> <!-- Enhanced Krishna Retributer -->
	</item>
	<item>
		<ingredient id="80101" count="1" /> <!-- Krishna Dual Sword -->
		<ingredient id="19440" count="1406" /> <!-- R-grade Gemstone -->
		<ingredient id="36515" count="7700" /> <!-- Elcyum -->
		<ingredient id="57" count="5058112338" /> <!-- Adena -->
		<production id="80144" count="1" /> <!-- Enhanced Krishna Dual Sword -->
	</item>
	<item>
		<ingredient id="80102" count="1" /> <!-- Krishna Dual Dagger -->
		<ingredient id="19440" count="1406" /> <!-- R-grade Gemstone -->
		<ingredient id="36515" count="7700" /> <!-- Elcyum -->
		<ingredient id="57" count="5058112338" /> <!-- Adena -->
		<production id="80145" count="1" /> <!-- Enhanced Krishna Dual Dagger -->
	</item>
	<item>
		<ingredient id="80103" count="1" /> <!-- Krishna Dual Blunt Weapon -->
		<ingredient id="19440" count="1406" /> <!-- R-grade Gemstone -->
		<ingredient id="36515" count="7700" /> <!-- Elcyum -->
		<ingredient id="57" count="5058112338" /> <!-- Adena -->
		<production id="80146" count="1" /> <!-- Enhanced Krishna Dual Blunt Weapon -->
	</item>
</list>