<?xml version="1.0" encoding="UTF-8"?>
<list xmlns:xsi="http://www.w3.org/2001/XMLSchema-instance" xsi:noNamespaceSchemaLocation="../../xsd/multisell.xsd">
	<npcs>
		<npc>-1</npc> <!-- CB -->
	</npcs>
	<item>
		<ingredient count="6000000" id="57" />
		<!-- Dark Crystal Heavy -->
		<production count="1" id="365" />
		<production count="1" id="512" />
		<production count="1" id="388" />
		<production count="1" id="5765" />
		<production count="1" id="5777" />
	</item>
	<item>
		<ingredient count="6000000" id="57" />
		<!-- Dark Crystal Light -->
		<production count="1" id="2385" />
		<production count="1" id="512" />
		<production count="1" id="2389" />
		<production count="1" id="5766" />
		<production count="1" id="5778" />
	</item>
	<item>
		<ingredient count="6000000" id="57" />
		<!-- Dark Crystal Robe -->
		<production count="1" id="2407" />
		<production count="1" id="512" />
		<production count="1" id="5767" />
		<production count="1" id="5779" />
	</item>
	<item>
		<ingredient count="3000000" id="57" />
		<!-- Dark Crystal Shield -->
		<production count="1" id="641" />
	</item>
	<item>
		<ingredient count="6000000" id="57" />
		<!-- Tallum Heavy -->
		<production count="1" id="2382" />
		<production count="1" id="547" />
		<production count="1" id="5768" />
		<production count="1" id="5780" />
	</item>
	<item>
		<ingredient count="6000000" id="57" />
		<!-- Tallum Light -->
		<production count="1" id="2393" />
		<production count="1" id="547" />
		<production count="1" id="5769" />
		<production count="1" id="5781" />
	</item>
	<item>
		<ingredient count="6000000" id="57" />
		<!-- Tallum Robe -->
		<production count="1" id="2400" />
		<production count="1" id="547" />
		<production count="1" id="2405" />
		<production count="1" id="5770" />
		<production count="1" id="5782" />
	</item>
	<item>
		<ingredient count="6773000" id="57" />
		<!-- Nightmare Heavy -->
		<production count="1" id="374" />
		<production count="1" id="2418" />
		<production count="1" id="5771" />
		<production count="1" id="5783" />
	</item>
	<item>
		<ingredient count="6000000" id="57" />
		<!-- Nightmare Light -->
		<production count="1" id="2394" />
		<production count="1" id="2418" />
		<production count="1" id="5772" />
		<production count="1" id="5784" />
	</item>
	<item>
		<ingredient count="6000000" id="57" />
		<!-- Nightmare Robe -->
		<production count="1" id="2408" />
		<production count="1" id="2418" />
		<production count="1" id="5773" />
		<production count="1" id="5785" />
	</item>
	<item>
		<ingredient count="3000000" id="57" />
		<!-- Nightmare Shield -->
		<production count="1" id="2498" />
	</item>
	<item>
		<ingredient count="6773000" id="57" />
		<!-- Majestic Heavy -->
		<production count="1" id="2383" />
		<production count="1" id="2419" />
		<production count="1" id="5774" />
		<production count="1" id="5786" />
	</item>
	<item>
		<ingredient count="6000000" id="57" />
		<!-- Majestic Light -->
		<production count="1" id="2395" />
		<production count="1" id="2419" />
		<production count="1" id="5775" />
		<production count="1" id="5787" />
	</item>
	<item>
		<ingredient count="6000000" id="57" />
		<!-- Majestic Robe -->
		<production count="1" id="2409" />
		<production count="1" id="2419" />
		<production count="1" id="5776" />
		<production count="1" id="5788" />
	</item>
	<item>
		<ingredient count="6000000" id="57" />
		<!-- Apella Heavy -->
		<production count="1" id="7861" />
		<production count="1" id="7860" />
		<production count="1" id="7862" />
		<production count="1" id="7863" />
	</item>
	<item>
		<ingredient count="6000000" id="57" />
		<!-- Apella Light -->
		<production count="1" id="7864" />
		<production count="1" id="7860" />
		<production count="1" id="7865" />
		<production count="1" id="7866" />
	</item>
	<item>
		<ingredient count="6000000" id="57" />
		<!-- Apella Robe -->
		<production count="1" id="7867" />
		<production count="1" id="7860" />
		<production count="1" id="7868" />
		<production count="1" id="7869" />
	</item>
</list>