<?xml version="1.0" encoding="UTF-8"?>
<list xmlns:xsi="http://www.w3.org/2001/XMLSchema-instance" xsi:noNamespaceSchemaLocation="../xsd/multisell.xsd">
	<npcs>
		<npc>33872</npc> <!-- Jenna -->
	</npcs>
	<item>
		<ingredient id="36434" count="1" /> <!-- Lindvior Shaper - Fragment --> 
		<ingredient id="36414" count="50" /> <!-- Dragon Claw --> 
		<!-- Elcyum -->
		<ingredient count="500" id="36515" />
		<!-- Giant's Energy -->
		<ingredient count="800" id="35563" />
		<!-- Gemstone (R-Grade) -->
		<ingredient count="105800" id="19440" />
		<production id="36458" count="1" /> <!-- Lindvior Shaper - Standard --> 
	</item>
	<item>
		<ingredient id="36435" count="1" /> <!-- Lindvior Thrower - Fragment --> 
		<ingredient id="36414" count="50" /> <!-- Dragon Claw --> 
		<!-- Elcyum -->
		<ingredient count="500" id="36515" />
		<!-- Giant's Energy -->
		<ingredient count="800" id="35563" />
		<!-- Gemstone (R-Grade) -->
		<ingredient count="105800" id="19440" />
		<production id="36459" count="1" /> <!-- Lindvior Thrower - Standard --> 
	</item>
	<item>
		<ingredient id="36436" count="1" /> <!-- Lindvior Slasher - Fragment --> 
		<ingredient id="36414" count="50" /> <!-- Dragon Claw --> 
		<!-- Elcyum -->
		<ingredient count="500" id="36515" />
		<!-- Giant's Energy -->
		<ingredient count="800" id="35563" />
		<!-- Gemstone (R-Grade) -->
		<ingredient count="105800" id="19440" />
		<production id="36460" count="1" /> <!-- Lindvior Slasher - Standard --> 
	</item>
	<item>
		<ingredient id="36437" count="1" /> <!-- Lindvior Caster - Fragment --> 
		<ingredient id="36414" count="50" /> <!-- Dragon Claw --> 
		<!-- Elcyum -->
		<ingredient count="500" id="36515" />
		<!-- Giant's Energy -->
		<ingredient count="800" id="35563" />
		<!-- Gemstone (R-Grade) -->
		<ingredient count="105800" id="19440" />
		<production id="36461" count="1" /> <!-- Lindvior Caster - Standard --> 
	</item>
	<item>
		<ingredient id="36438" count="1" /> <!-- Lindvior Cutter - Fragment --> 
		<ingredient id="36414" count="50" /> <!-- Dragon Claw --> 
		<!-- Elcyum -->
		<ingredient count="500" id="36515" />
		<!-- Giant's Energy -->
		<ingredient count="800" id="35563" />
		<!-- Gemstone (R-Grade) -->
		<ingredient count="105800" id="19440" />
		<production id="36462" count="1" /> <!-- Lindvior Cutter - Standard --> 
	</item>
	<item>
		<ingredient id="36439" count="1" /> <!-- Lindvior Shooter - Fragment --> 
		<ingredient id="36414" count="50" /> <!-- Dragon Claw --> 
		<!-- Elcyum -->
		<ingredient count="500" id="36515" />
		<!-- Giant's Energy -->
		<ingredient count="800" id="35563" />
		<!-- Gemstone (R-Grade) -->
		<ingredient count="105800" id="19440" />
		<production id="36463" count="1" /> <!-- Lindvior Shooter - Standard --> 
	</item>
	<item>
		<ingredient id="36440" count="1" /> <!-- Lindvior Dual Dagger - Fragment --> 
		<ingredient id="36414" count="50" /> <!-- Dragon Claw --> 
		<!-- Elcyum -->
		<ingredient count="500" id="36515" />
		<!-- Giant's Energy -->
		<ingredient count="800" id="35563" />
		<!-- Gemstone (R-Grade) -->
		<ingredient count="105800" id="19440" />
		<production id="36464" count="1" /> <!-- Lindvior Dual Dagger - Standard --> 
	</item>
</list>